{
  "checkpoint": "CP03",
  "first_executable_task": "CP03-002",
  "frontier_wave": "CP03-W02",
  "iteration": "I03",
  "project_id": "CLEVER-JARVIS-001",
  "schema_version": 1,
  "status_model": [
    "READY",
    "BLOCKED",
    "IN_PROGRESS",
    "COMPLETE"
  ],
  "tasks": [
    {
      "depends_on": [],
      "gates": [
        "evidence-backed wave gate",
        "Agentic Contract",
        "parity denominator unchanged"
      ],
      "id": "CP03-000",
      "objective": "Run hermetic pinned OpenJarvis baseline and classify gated tests.",
      "outputs": [
        "evidence/cp03/cp03-w00/"
      ],
      "owner_role": "release_reconciler",
      "priority": "P0",
      "status": "COMPLETE",
      "wave": "CP03-W00"
    },
    {
      "depends_on": [
        "CP03-000"
      ],
      "gates": [
        "evidence-backed wave gate",
        "Agentic Contract",
        "parity denominator unchanged"
      ],
      "id": "CP03-001",
      "objective": "Implement supervised adapter transport, lifecycle and typed registry bridge.",
      "outputs": [
        "evidence/cp03/cp03-w01/"
      ],
      "owner_role": "builder",
      "priority": "P0",
      "status": "COMPLETE",
      "wave": "CP03-W01"
    },
    {
      "depends_on": [
        "CP03-001"
      ],
      "gates": [
        "evidence-backed wave gate",
        "Agentic Contract",
        "parity denominator unchanged"
      ],
      "id": "CP03-002",
      "objective": "Map models, engines and inference behavior through canonical contracts.",
      "outputs": [
        "evidence/cp03/cp03-w02/"
      ],
      "owner_role": "builder",
      "priority": "P0",
      "status": "READY",
      "wave": "CP03-W02"
    },
    {
      "depends_on": [
        "CP03-002"
      ],
      "gates": [
        "evidence-backed wave gate",
        "Agentic Contract",
        "parity denominator unchanged"
      ],
      "id": "CP03-003",
      "objective": "Map agents, tools and MCP while enforcing Clever action authority.",
      "outputs": [
        "evidence/cp03/cp03-w03/"
      ],
      "owner_role": "builder",
      "priority": "P0",
      "status": "BLOCKED",
      "wave": "CP03-W03"
    },
    {
      "depends_on": [
        "CP03-003"
      ],
      "gates": [
        "evidence-backed wave gate",
        "Agentic Contract",
        "parity denominator unchanged"
      ],
      "id": "CP03-004",
      "objective": "Map memory/retrieval with principal-scoped ownership and provenance.",
      "outputs": [
        "evidence/cp03/cp03-w04/"
      ],
      "owner_role": "builder",
      "priority": "P0",
      "status": "BLOCKED",
      "wave": "CP03-W04"
    },
    {
      "depends_on": [
        "CP03-004"
      ],
      "gates": [
        "evidence-backed wave gate",
        "Agentic Contract",
        "parity denominator unchanged"
      ],
      "id": "CP03-005",
      "objective": "Map traces, telemetry, evals and proposal-only learning signals.",
      "outputs": [
        "evidence/cp03/cp03-w05/"
      ],
      "owner_role": "builder",
      "priority": "P0",
      "status": "BLOCKED",
      "wave": "CP03-W05"
    },
    {
      "depends_on": [
        "CP03-005"
      ],
      "gates": [
        "evidence-backed wave gate",
        "Agentic Contract",
        "parity denominator unchanged"
      ],
      "id": "CP03-006",
      "objective": "Map scheduler/proactive/persistent operative semantics with replay safety.",
      "outputs": [
        "evidence/cp03/cp03-w06/"
      ],
      "owner_role": "builder",
      "priority": "P0",
      "status": "BLOCKED",
      "wave": "CP03-W06"
    },
    {
      "depends_on": [
        "CP03-006"
      ],
      "gates": [
        "evidence-backed wave gate",
        "Agentic Contract",
        "parity denominator unchanged"
      ],
      "id": "CP03-007",
      "objective": "Reconcile OpenJarvis defense-in-depth security under Clever T0 policy.",
      "outputs": [
        "evidence/cp03/cp03-w07/"
      ],
      "owner_role": "builder",
      "priority": "P0",
      "status": "BLOCKED",
      "wave": "CP03-W07"
    },
    {
      "depends_on": [
        "CP03-007"
      ],
      "gates": [
        "evidence-backed wave gate",
        "Agentic Contract",
        "parity denominator unchanged"
      ],
      "id": "CP03-008",
      "objective": "Compile and burn down parity for all 646 OpenJarvis obligations.",
      "outputs": [
        "evidence/cp03/cp03-w08/"
      ],
      "owner_role": "release_reconciler",
      "priority": "P0",
      "status": "BLOCKED",
      "wave": "CP03-W08"
    },
    {
      "depends_on": [
        "CP03-008"
      ],
      "gates": [
        "evidence-backed wave gate",
        "Agentic Contract",
        "parity denominator unchanged"
      ],
      "id": "CP03-009",
      "objective": "Run adversarial recovery and performance gauntlet.",
      "outputs": [
        "evidence/cp03/cp03-w09/"
      ],
      "owner_role": "release_reconciler",
      "priority": "P0",
      "status": "BLOCKED",
      "wave": "CP03-W09"
    },
    {
      "depends_on": [
        "CP03-009"
      ],
      "gates": [
        "evidence-backed wave gate",
        "Agentic Contract",
        "parity denominator unchanged"
      ],
      "id": "CP03-010",
      "objective": "Reconcile CP03 release evidence and hand off to CP04.",
      "outputs": [
        "evidence/cp03/cp03-w10/"
      ],
      "owner_role": "release_reconciler",
      "priority": "P0",
      "status": "BLOCKED",
      "wave": "CP03-W10"
    }
  ]
}
